{"dataset_version":"2026-09-02","schema_version":"national-ux-summary-v1","scope":"territory","territories":[{"source_summaries":[{"coverage":{"from":1968,"status":"available","to":2023},"entity_type":"administrative_source_record","metrics":[{"metric_id":"egif_record_count","unit":"records","values":[0,0,0,0,0,0,0,0,0,0,0,0,0,0,0,0,0,90,93,38,0,540,150,174,90,156,211,0,0,0,0,0,0,0,119,277,261,698,450,504,595,667,598,559,661,258,331,287,184,322,206,482,290,281,0,0]},{"known_value_count":[0,0,0,0,0,0,0,0,0,0,0,0,0,0,0,0,0,90,93,38,0,540,150,174,90,156,211,0,0,0,0,0,0,0,119,277,261,698,450,504,595,667,598,559,661,258,331,287,184,322,206,482,290,281,0,0],"metric_id":"egif_declared_forest_area_ha","unit":"ha","unknown_value_count":[0,0,0,0,0,0,0,0,0,0,0,0,0,0,0,0,0,0,0,0,0,0,0,0,0,0,0,0,0,0,0,0,0,0,0,0,0,0,0,0,0,0,0,0,0,0,0,0,0,0,0,0,0,0,0,0],"values":[0,0,0,0,0,0,0,0,0,0,0,0,0,0,0,0,0,1890.7,1172,601.4,0,7204.4,699,559.4,547.8,882.9,2629.7,0,0,0,0,0,0,0,2248.08,467.79,338.24,1370.97,770.2,473.86,1133.79,1750.12,652.26,614.79,1675.86,356.79,932.98,1084.28,1715.39,1325.62,387.84,1901.86,531.91,2495.1606,0,0]},{"false_value_count":[0,0,0,0,0,0,0,0,0,0,0,0,0,0,0,0,0,90,93,38,0,539,150,174,90,156,210,0,0,0,0,0,0,0,119,277,261,698,450,504,595,666,598,559,660,258,331,287,183,322,206,482,290,280,0,0],"metric_id":"egif_administrative_gif_count","unit":"records","unknown_value_count":[0,0,0,0,0,0,0,0,0,0,0,0,0,0,0,0,0,0,0,0,0,0,0,0,0,0,0,0,0,0,0,0,0,0,0,0,0,0,0,0,0,0,0,0,0,0,0,0,0,0,0,0,0,0,0,0],"values":[0,0,0,0,0,0,0,0,0,0,0,0,0,0,0,0,0,0,0,0,0,1,0,0,0,0,1,0,0,0,0,0,0,0,0,0,0,0,0,0,0,1,0,0,1,0,0,0,1,0,0,0,0,1,0,0]}],"quality_counts":{"municipality_unresolved":[0,0,0,0,0,0,0,0,0,0,0,0,0,0,0,0,0,0,0,0,0,0,0,0,0,0,0,0,0,0,0,0,0,0,0,3,0,0,1,0,0,0,0,8,13,3,3,2,2,1,1,5,0,4,0,0]},"source_id":"egif","year_axis":{"from":1968,"semantics":"dense_within_coverage","to":2023}},{"coverage":{"from":1985,"status":"available","to":2021},"entity_type":"landsat_perimeter","metrics":[{"metric_id":"esfire30_perimeter_count","unit":"perimeters","values":[40,39,11,29,73,28,6,18,13,21,103,47,28,53,15,60,11,57,22,34,12,9,8,30,47,23,23,35,13,30,14,31,89,23,83,48,65]}],"source_id":"esfire30","year_axis":{"from":1985,"semantics":"dense_within_coverage","to":2021}}],"territory":{"official_name":"Navarra","parent_id":"ES:CCAA:15","territory_id":"ES:PROV:31","territory_type":"province"}}]}