{"dataset_version":"2026-09-02","schema_version":"national-ux-summary-v1","scope":"territory","territories":[{"source_summaries":[{"coverage":{"from":1968,"status":"available","to":2023},"entity_type":"administrative_source_record","metrics":[{"metric_id":"egif_record_count","unit":"records","values":[0,0,0,0,0,0,0,0,0,0,0,0,0,0,0,0,0,0,0,0,0,0,0,0,0,0,0,0,0,0,0,0,0,0,0,0,0,0,0,0,0,0,0,0,0,0,0,0,0,0,0,0,0,0,0,0]},{"known_value_count":[0,0,0,0,0,0,0,0,0,0,0,0,0,0,0,0,0,0,0,0,0,0,0,0,0,0,0,0,0,0,0,0,0,0,0,0,0,0,0,0,0,0,0,0,0,0,0,0,0,0,0,0,0,0,0,0],"metric_id":"egif_declared_forest_area_ha","unit":"ha","unknown_value_count":[0,0,0,0,0,0,0,0,0,0,0,0,0,0,0,0,0,0,0,0,0,0,0,0,0,0,0,0,0,0,0,0,0,0,0,0,0,0,0,0,0,0,0,0,0,0,0,0,0,0,0,0,0,0,0,0],"values":[0,0,0,0,0,0,0,0,0,0,0,0,0,0,0,0,0,0,0,0,0,0,0,0,0,0,0,0,0,0,0,0,0,0,0,0,0,0,0,0,0,0,0,0,0,0,0,0,0,0,0,0,0,0,0,0]},{"false_value_count":[0,0,0,0,0,0,0,0,0,0,0,0,0,0,0,0,0,0,0,0,0,0,0,0,0,0,0,0,0,0,0,0,0,0,0,0,0,0,0,0,0,0,0,0,0,0,0,0,0,0,0,0,0,0,0,0],"metric_id":"egif_administrative_gif_count","unit":"records","unknown_value_count":[0,0,0,0,0,0,0,0,0,0,0,0,0,0,0,0,0,0,0,0,0,0,0,0,0,0,0,0,0,0,0,0,0,0,0,0,0,0,0,0,0,0,0,0,0,0,0,0,0,0,0,0,0,0,0,0],"values":[0,0,0,0,0,0,0,0,0,0,0,0,0,0,0,0,0,0,0,0,0,0,0,0,0,0,0,0,0,0,0,0,0,0,0,0,0,0,0,0,0,0,0,0,0,0,0,0,0,0,0,0,0,0,0,0]}],"quality_counts":{"municipality_unresolved":[0,0,0,0,0,0,0,0,0,0,0,0,0,0,0,0,0,0,0,0,0,0,0,0,0,0,0,0,0,0,0,0,0,0,0,0,0,0,0,0,0,0,0,0,0,0,0,0,0,0,0,0,0,0,0,0]},"source_id":"egif","year_axis":{"from":1968,"semantics":"dense_within_coverage","to":2023}},{"coverage":{"from":1985,"status":"no_source_coverage","to":2021},"entity_type":"landsat_perimeter","metrics":[],"source_id":"esfire30","year_axis":{"from":1985,"semantics":"dense_within_coverage","to":2021}}],"territory":{"official_name":"Melilla","parent_id":"ES","territory_id":"ES:CCAA:19","territory_type":"autonomous_city"}}]}