{"dataset_version":"2026-09-02","schema_version":"national-ux-summary-v1","scope":"territory","territories":[{"source_summaries":[{"coverage":{"from":1968,"status":"available","to":2023},"entity_type":"administrative_source_record","metrics":[{"metric_id":"egif_record_count","unit":"records","values":[52,21,43,18,0,26,63,50,69,48,125,96,135,237,90,105,100,99,88,137,115,115,222,259,201,192,183,97,119,93,173,183,159,121,101,124,145,150,122,91,84,109,108,123,130,93,118,89,95,81,93,69,88,71,70,96]},{"known_value_count":[52,21,43,18,0,26,63,50,69,48,125,96,135,237,90,105,100,99,88,137,115,115,222,259,201,192,183,97,119,93,173,183,159,121,101,124,145,150,122,91,84,109,108,123,130,93,118,89,95,81,93,69,88,71,70,96],"metric_id":"egif_declared_forest_area_ha","unit":"ha","unknown_value_count":[0,0,0,0,0,0,0,0,0,0,0,0,0,0,0,0,0,0,0,0,0,0,0,0,0,0,0,0,0,0,0,0,0,0,0,0,0,0,0,0,0,0,0,0,0,0,0,0,0,0,0,0,0,0,0,0],"values":[3282.1,494.7,7765.1,3140.9,0,686.8,2489.5,730.3,3163.7,1456.7,11075.4,6258,12074,6017.6,922.3,2862.5,1525.6,1171.3,3408.9,334.5,923.7,663,12356.4,6222.2,4279.9,2644.7,4855.8,1036.7,347.7,269.6,823.58,1341.78,1837.71,599.72,775.21,1036.35,103.07,332.2,739.76,90.71,115.15,1459.3,848.15,338.73,1532.66,120.76,658.94,1851.34,1247.98,40.83,114.96,902.041,498.8201,47.0431,10735.6487,122.0684]},{"false_value_count":[51,21,39,17,0,26,63,50,68,47,121,91,127,234,90,105,100,99,85,137,115,115,218,255,200,190,180,96,119,93,173,183,158,121,101,123,145,150,122,91,84,108,107,123,128,93,118,88,94,81,93,68,88,71,69,96],"metric_id":"egif_administrative_gif_count","unit":"records","unknown_value_count":[0,0,0,0,0,0,0,0,0,0,0,0,0,0,0,0,0,0,0,0,0,0,0,0,0,0,0,0,0,0,0,0,0,0,0,0,0,0,0,0,0,0,0,0,0,0,0,0,0,0,0,0,0,0,0,0],"values":[1,0,4,1,0,0,0,0,1,1,4,5,8,3,0,0,0,0,3,0,0,0,4,4,1,2,3,1,0,0,0,0,1,0,0,1,0,0,0,0,0,1,1,0,2,0,0,1,1,0,0,1,0,0,1,0]}],"quality_counts":{"municipality_unresolved":[52,21,43,18,0,26,63,50,69,48,125,96,135,237,90,0,0,0,0,0,0,0,0,0,0,0,0,0,0,0,0,1,1,2,0,1,0,0,0,0,0,0,1,0,1,0,0,0,0,0,0,0,0,0,0,0]},"source_id":"egif","year_axis":{"from":1968,"semantics":"dense_within_coverage","to":2023}},{"coverage":{"from":1985,"status":"available","to":2021},"entity_type":"landsat_perimeter","metrics":[{"metric_id":"esfire30_perimeter_count","unit":"perimeters","values":[15,18,3,10,13,53,52,43,25,18,7,5,7,11,19,14,4,7,15,6,9,6,5,2,10,4,11,6,5,8,8,9,4,6,3,7,20]}],"source_id":"esfire30","year_axis":{"from":1985,"semantics":"dense_within_coverage","to":2021}},{"coverage":{"from":1993,"status":"available","to":2024},"entity_type":"official_fire_record_and_perimeter","metrics":[{"metric_id":"icv_fire_record_count","unit":"fire_records","values":[192,183,97,119,93,173,183,159,121,101,124,145,150,122,91,84,109,108,123,130,93,118,89,95,81,93,69,88,71,70,96,98]},{"metric_id":"icv_perimeter_count","unit":"perimeters","values":[192,183,97,119,93,173,183,159,121,101,124,145,150,122,91,84,109,108,123,130,93,118,89,95,81,93,69,88,71,70,96,99]},{"known_value_count":[192,183,97,119,93,173,183,159,121,101,124,145,150,122,91,84,109,108,123,130,93,118,89,95,81,93,69,88,71,70,96,98],"metric_id":"icv_declared_forest_area_ha","unit":"ha","unknown_value_count":[0,0,0,0,0,0,0,0,0,0,0,0,0,0,0,0,0,0,0,0,0,0,0,0,0,0,0,0,0,0,0,0],"values":[2644.7,4855.8,1036.7,347.7,269.6,823.58,1341.78,1837.71,599.72,775.21,1036.35,103.07,332.2,739.76,90.71,115.15,1459.3,848.15,338.73,1532.66,120.76,658.94,1851.34,1268.6589,39.5298,113.4049,884.4662,499.0304,47.9231,10735.6487,122.0644,820.8584]},{"false_value_count":[190,180,96,119,93,173,183,158,121,101,123,145,150,122,91,84,108,107,123,128,93,118,88,94,81,93,68,88,71,69,96,97],"metric_id":"icv_gif_count","unit":"fire_records","unknown_value_count":[0,0,0,0,0,0,0,0,0,0,0,0,0,0,0,0,0,0,0,0,0,0,0,0,0,0,0,0,0,0,0,0],"values":[2,3,1,0,0,0,0,1,0,0,1,0,0,0,0,0,1,1,0,2,0,0,1,1,0,0,1,0,0,1,0,1]}],"source_id":"icv","year_axis":{"from":1993,"semantics":"dense_within_coverage","to":2024}},{"coverage":{"from":2025,"status":"available","to":2026},"entity_type":"provisional_satellite_perimeter","metrics":[{"metric_id":"effis_perimeter_count","unit":"perimeters","values":[4,5]},{"known_value_count":[4,5],"metric_id":"effis_mapped_area_ha","unit":"ha","unknown_value_count":[0,0],"values":[224,13]}],"snapshot":"20260819T174426Z","source_id":"effis","year_axis":{"from":2025,"semantics":"dense_within_coverage","to":2026}}],"territory":{"official_name":"Alicante/Alacant","parent_id":"ES:CCAA:10","territory_id":"ES:PROV:03","territory_type":"province"}}]}