{"dataset_version":"2026-09-02","parent_id":"ES:CCAA:18","schema_version":"national-ux-summary-v1","scope":"municipalities_by_parent","territories":[{"source_summaries":[{"coverage":{"from":1968,"status":"available","to":2023},"entity_type":"administrative_source_record","metrics":[{"metric_id":"egif_record_count","unit":"records","values":[0,0,0,0,0,0,0,0,0,0,0,0,0,0,0,0,0,0,0,0,0,0,0,1,0,1,0,3,3,0,0,0,0,0,0,0,3,0,0,0,1,2,0,0,0,0,1,1,1,0,1,2,0,0,2,0]},{"known_value_count":[0,0,0,0,0,0,0,0,0,0,0,0,0,0,0,0,0,0,0,0,0,0,0,1,0,1,0,3,3,0,0,0,0,0,0,0,3,0,0,0,1,2,0,0,0,0,1,1,1,0,1,2,0,0,2,0],"metric_id":"egif_declared_forest_area_ha","unit":"ha","unknown_value_count":[0,0,0,0,0,0,0,0,0,0,0,0,0,0,0,0,0,0,0,0,0,0,0,0,0,0,0,0,0,0,0,0,0,0,0,0,0,0,0,0,0,0,0,0,0,0,0,0,0,0,0,0,0,0,0,0],"values":[0,0,0,0,0,0,0,0,0,0,0,0,0,0,0,0,0,0,0,0,0,0,0,2,0,95,0,5.1,0.21,0,0,0,0,0,0,0,21,0,0,0,2,3.5,0,0,0,0,28.55,30,3,0,72.91,53.71,0,0,117.87,0]},{"false_value_count":[0,0,0,0,0,0,0,0,0,0,0,0,0,0,0,0,0,0,0,0,0,0,0,1,0,1,0,3,3,0,0,0,0,0,0,0,3,0,0,0,1,2,0,0,0,0,1,1,1,0,1,2,0,0,2,0],"metric_id":"egif_administrative_gif_count","unit":"records","unknown_value_count":[0,0,0,0,0,0,0,0,0,0,0,0,0,0,0,0,0,0,0,0,0,0,0,0,0,0,0,0,0,0,0,0,0,0,0,0,0,0,0,0,0,0,0,0,0,0,0,0,0,0,0,0,0,0,0,0],"values":[0,0,0,0,0,0,0,0,0,0,0,0,0,0,0,0,0,0,0,0,0,0,0,0,0,0,0,0,0,0,0,0,0,0,0,0,0,0,0,0,0,0,0,0,0,0,0,0,0,0,0,0,0,0,0,0]}],"quality_counts":{"municipality_unresolved":[0,0,0,0,0,0,0,0,0,0,0,0,0,0,0,0,0,0,0,0,0,0,0,0,0,0,0,0,0,0,0,0,0,0,0,0,0,0,0,0,0,0,0,0,0,0,0,0,0,0,0,0,0,0,0,0]},"source_id":"egif","year_axis":{"from":1968,"semantics":"dense_within_coverage","to":2023}},{"coverage":{"from":1985,"status":"no_source_coverage","to":2021},"entity_type":"landsat_perimeter","metrics":[],"source_id":"esfire30","year_axis":{"from":1985,"semantics":"dense_within_coverage","to":2021}}],"territory":{"official_name":"Ceuta","parent_id":"ES:CCAA:18","territory_id":"ES:MUN:51001","territory_type":"municipality"}}]}